id,categoryId,topic,headline,body,summary,tags,readTimeSeconds,funScore,featured,relatedFactIds
renaissance-perspective,history,Renaissance,Artists Invented Mathematical Perspective,"During the Renaissance, artists made a breakthrough: linear perspective. Using geometry, painters learned to create the illusion of depth on a flat surface, with lines meeting at a single vanishing point. The architect Filippo Brunelleschi is credited with showing the trick in early-1400s Florence. Suddenly paintings looked like windows into real, 3D space. This blend of art and math captures the Renaissance perfectly — an age when careful observation changed even how beauty was made.",Geometry let painters fake real depth on a flat wall.,"history,renaissance,art,mathematics",37,10,false,
renaissance-leonardo-scientist,history,Renaissance,Leonardo Was More Than an Artist,"Leonardo da Vinci is famous for the Mona Lisa, but painting was just one of his talents. He dissected human bodies to learn anatomy, studied how water flows, designed bridges and war machines, and sketched inventions far ahead of his time. His notebooks are packed with notes on light, plants, and the human heart. To him, art and science were two ways of understanding the same world. He became the ultimate “Renaissance man.”","He dissected bodies, designed machines, and studied rivers.","history,renaissance,leonardo,science",37,10,false,
american-revolution-loyalists,history,American Revolution,Not Everyone Wanted Independence,"We remember the American Revolution as a united uprising, but the colonists were deeply split. Patriots wanted independence, but a large group called Loyalists wanted to stay British — and many others tried to stay neutral. Historians think about a fifth of the population remained loyal to the king, splitting families and neighbors. After the war, many Loyalists fled to Canada or Britain, losing their homes. The Revolution was partly a fight among Americans themselves.",Maybe a fifth of colonists wanted to stay British.,"history,american-revolution,loyalists,britain",41,10,false,
american-revolution-civil-war,history,American Revolution,The Revolution Began as a Civil War,"In its early years, the American Revolution looked less like two nations at war and more like a civil war inside the British Empire. The colonists still saw themselves as British, and the fighting pitted Patriots against Loyalists who stayed faithful to the king. Neighbors, friends, and even relatives ended up on opposite sides. Bitter local feuds played out alongside the big battles. Only over time did it harden into a war for full independence.","Early on, it was neighbor against neighbor, not nation vs nation.","history,american-revolution,civil-war,british-empire",37,10,false,
american-revolution-french-navy,history,American Revolution,The French Navy Helped Win the War,"One of the biggest turning points of the Revolution came at sea, thanks to France. At the 1781 Battle of the Chesapeake, French warships blocked the British fleet from rescuing their army trapped at Yorktown, Virginia. Cut off by water and surrounded on land, the British commander Cornwallis had to surrender. That defeat basically ended the major fighting. It showed that control of the seas could decide a war fought on land.","The war's turning point happened at sea, not on land.","history,american-revolution,france,yorktown,navy",39,10,false,
american-revolution-paul-revere,history,American Revolution,Paul Revere Didn't Ride Alone,"Paul Revere's midnight ride is a legend — but the real story is bigger than one rider. On that April night in 1775, Revere rode to warn that British troops were moving, but other riders like William Dawes and Samuel Prescott rode too. In fact, a British patrol stopped Revere before he could finish. A whole network of riders spread the alarm, not one lone hero. A poem written almost a century later made him the star.",He was actually stopped before finishing the famous ride.,"history,american-revolution,paul-revere,communication",40,9,false,
american-revolution-german-soldiers,history,American Revolution,Britain Hired German Troops,"Britain didn't have enough soldiers to fight its colonies, so it hired thousands from German states. Many came from a region called Hesse, so Americans called them “Hessians.” These professional troops fought in major battles and were feared for their discipline. The idea of foreign hired soldiers crushing the rebellion also fueled Patriot anger. After the war, some of these Germans chose to stay and settle in America.",Thousands of 'Hessians' fought for Britain for pay.,"history,american-revolution,germany,hessians",39,10,false,
industrial-revolution-secret-tech,history,Industrial Revolution,Britain Tried to Keep Industrial Secrets,"When new machines transformed manufacturing in 1700s Britain, the country tried to keep its edge secret. Britain treated its technology almost like a state secret, hoping to dominate world manufacturing. Laws blocked the export of advanced machines, and skilled workers were discouraged from leaving. For a while, this gave Britain a huge head start. But knowledge always finds a way out, and the innovations eventually spread across the world.",New machines were guarded almost like state secrets.,"history,industrial-revolution,britain,technology",37,10,false,
industrial-revolution-illegal-export,history,Industrial Revolution,Exporting Industrial Know-How Was Illegal,"To protect its lead, Britain made it illegal to export key machines or take detailed plans abroad. Skilled engineers who understood the factories were even banned from leaving — their knowledge was as valuable as the machines. But determined people smuggled out designs and memorized blueprints anyway. One famous figure rebuilt British machinery from memory after moving to America. It shows how hard it is to lock away an idea once it's proven its worth.",One man rebuilt British machines from memory in America.,"history,industrial-revolution,britain,inventions",39,10,false,
industrial-revolution-spinning-jenny,history,Industrial Revolution,The Spinning Jenny Changed Manufacturing,"Of all the inventions that launched the Industrial Revolution, the spinning jenny stands out. Built by James Hargreaves in the 1760s, it let a single worker spin many threads of yarn at once instead of just one. That made cloth far cheaper and faster to produce. As the jenny spread, cloth-making moved out of homes and into busy factories. A fairly simple machine helped trigger one of the biggest economic changes in history.",One worker could suddenly spin many threads at once.,"history,industrial-revolution,spinning-jenny,textiles",36,9,false,
industrial-revolution-child-labor,history,Industrial Revolution,Children Worked in Factories,"Early factories and mines ran heavily on child labor. Boys and girls as young as five or six worked long, exhausting hours for tiny wages, squeezing under machines or hauling loads in dark coal pits. Employers liked children because they were cheap and small enough to reach tight spaces. Many were hurt or never got an education. Public outrage eventually led to some of the first laws protecting workers.",Kids as young as five worked long days in mines and mills.,"history,industrial-revolution,child-labor,workers",37,9,false,
industrial-revolution-modern-world,history,Industrial Revolution,Modern Life Was Built During the Industrial Revolution,"So much of today's world was shaped during the Industrial Revolution. Steam engines, factories, railways, and later electricity and steel changed how people traveled, worked, and made things. Cities boomed as people moved from farms to industrial towns, creating modern city life. The era also sparked new economic systems and a fast pace of invention that's never slowed. Look at our machines and cities — they're the long shadow of that age.","Cities, factories, and fast change all trace back to it.","history,industrial-revolution,inventions,technology",38,10,false,
ancient-china-terracotta-army,history,Ancient China,China's First Emperor Was Buried With an Army,"When China's First Emperor, Qin Shi Huang, died, he was buried with one of the wildest creations of the ancient world: an army made of clay. Thousands of life-sized terracotta soldiers, plus horses and chariots, stood in giant underground pits to guard him in the afterlife. Each figure had its own face, hairstyle, and armor. The buried army stayed hidden for over 2,000 years, until farmers stumbled on it in 1974. It's a stunning glimpse of ancient China's power.",Thousands of clay soldiers — each with a unique face.,"history,ancient-china,terracotta-army,qin-shi-huang",39,10,false,
ancient-china-paper,history,Ancient China,Paper Was Invented in China,"One of history's most important inventions came from ancient China: paper. Around the 2nd century CE, a court official named Cai Lun refined a way to make paper from tree bark, rags, and old fishing nets. It was far cheaper and easier than older writing surfaces like silk or bamboo. Suddenly knowledge could be recorded and shared on a huge scale. Over centuries the idea spread worldwide, becoming the basis of books and learning.","Made from bark, rags, and old fishing nets.","history,ancient-china,paper,inventions",39,10,false,
ancient-china-compass,history,Ancient China,The Compass Originated in China,"Long before global voyages, China invented a tool that would guide explorers: the compass. Early Chinese inventors noticed that a magnetized needle naturally points north-south. At first they used it for fortune-telling and arranging buildings — not travel. Later it was adapted for navigation, letting sailors find their way out of sight of land. Carried west along trade routes, the compass helped launch the great age of sea exploration.","It was first used for fortune-telling, not sailing.","history,ancient-china,compass,navigation",37,10,false,
ancient-china-gunpowder,history,Ancient China,Gunpowder Began as a Chinese Discovery,"Gunpowder was discovered in China — completely by accident. Around the 9th century, Chinese alchemists were trying to make a potion for eternal life. Instead, they mixed something that exploded when lit. It never made anyone immortal, but it was perfect for fireworks, signal flares, and later, weapons. The Chinese went on to build early bombs and rockets. As the recipe spread west along trade routes, it changed battlefields all over the world.",They were hunting for a potion to live forever. They found something explosive instead.,"history,ancient-china,gunpowder,inventions",37,10,false,
ancient-china-wu-zetian,history,Ancient China,China Had One Female Emperor,"In a world where emperors were almost always men, one woman took the throne. Wu Zetian started as a concubine but, through sharp political skill, seized supreme power and declared her own dynasty in 690 CE. As emperor, she reformed the government and promoted talented officials no matter their birth. Her rise smashed one of the most rigid barriers in Chinese politics. Controversial then and now, she remains a striking example of ambition overcoming tradition.",She started as a concubine and ended up declaring her own dynasty.,"history,ancient-china,wu-zetian,emperors",38,10,false,
ancient-india-sewage-systems,history,Ancient India,Some Indus Cities Had Sewage Systems,The ancient cities of the Indus Valley had sanitation so advanced it wouldn't be matched for thousands of years. Homes in places like Mohenjo-daro had private bathrooms and drains that carried wastewater into covered sewers beneath the streets. Many even had wells and bathing areas. This careful handling of water and waste was remarkably modern. It's proof that some ancient peoples solved everyday problems with surprising sophistication.,"Homes had private bathrooms 4,000 years ago.","history,ancient-india,indus-valley,sewage",38,10,false,
ancient-india-zero,history,Ancient India,Zero Changed Mathematics Forever,"One of the most powerful ideas in math — the number zero — took shape in ancient India. Other cultures used placeholders, but Indian mathematicians treated zero as a real number you could calculate with, and scholars like Brahmagupta wrote rules for using it. That made it possible to write huge numbers and do complex arithmetic. The idea spread west through the Islamic world into Europe. Modern math, computers, and money would be unthinkable without it.",Treating 'nothing' as a number rewired all of math.,"history,ancient-india,zero,mathematics",38,10,false,
ancient-india-chess,history,Ancient India,Chess Traces Back to Ancient India,"Chess can be traced back to ancient India, where an early version called chaturanga was played over 1,500 years ago. Its pieces mirrored the four parts of an Indian army — infantry, cavalry, elephants, and chariots — which became today's pawns, knights, bishops, and rooks. From India the game spread to Persia, the Islamic world, and Europe, changing along the way. Each culture added its own twists. A game born in India is now played all over the world.",The pieces began as the four parts of an Indian army.,"history,ancient-india,chess,chaturanga",41,10,false,
ancient-india-ashoka-peace,history,Ancient India,Ashoka Turned From War to Peace,"Ashoka was one of ancient India's most powerful emperors, ruling a vast realm in the 3rd century BCE. Early on, he fought a brutal war to conquer the kingdom of Kalinga — but the death and suffering it caused shook him deeply. Afterward, he embraced Buddhism and turned away from violence, promoting peace and tolerance instead. He spread his ideals through messages carved on pillars and rocks across his empire. His change from conqueror to peacemaker is one of history's most famous.",One brutal war horrified him into a life of peace.,"history,ancient-india,ashoka,buddhism",40,10,false,
ancient-india-surgery,history,Ancient India,Ancient Indian Doctors Practiced Surgery,"Ancient India had surprisingly advanced medicine — including surgery. A physician named Sushruta, who lived over 2,000 years ago, described hundreds of procedures and dozens of instruments in his writings. Amazingly, his texts cover early plastic surgery, like rebuilding noses, plus cataract operations and wound care. These doctors understood the value of cleanliness and preparation. It shows the roots of modern surgery reach back much further — and to more places — than many people think.","A surgeon described nose reconstructions 2,000 years ago.","history,ancient-india,medicine,surgery",38,9,false,
mongol-empire-largest-contiguous,history,Mongol Empire,The Mongols Built the Largest Contiguous Empire Ever,"At its peak in the 1200s, the Mongol Empire was the largest connected land empire in history. It covered about nine million square miles, reaching from the Pacific coast of Asia to the edges of Europe. Unlike sea empires scattered across distant colonies, it was one continuous stretch of land. It linked many peoples, religions, and trade routes under a single rule. That nomads from the steppes built it in just a few generations is astonishing.","Nine million square miles, all in one connected block.","history,mongol-empire,genghis-khan,empires",40,10,false,
mongol-empire-span,history,Mongol Empire,The Empire Reached From the Pacific to Europe,"The Mongol Empire stretched across an almost unimaginable area. From the Pacific Ocean in the east, its power reached across China, Central Asia, Persia, and into parts of Eastern Europe. A traveler could ride for months and still be within Mongol lands. This connected civilizations that had barely known each other, letting goods and ideas flow across Eurasia. The empire's size redrew the map of the medieval world.",You could travel for months and never leave Mongol land.,"history,mongol-empire,europe,asia",37,10,false,
mongol-empire-small-armies,history,Mongol Empire,The Mongols Didn't Need Huge Armies,"The Mongols conquered much of the world without huge numbers. Their armies were often smaller than the ones they beat, yet they won through strategy, discipline, and speed. Commanders used clever tricks, like fake retreats to lure enemies into traps. Fast horsemen could strike where they were least expected. By valuing planning over brute force, the Mongols proved how an army fights can matter more than its size.",They often won while outnumbered — with speed and tricks.,"history,mongol-empire,military,warfare",36,10,false,
mongol-empire-messenger-network,history,Mongol Empire,The Mongols Had a Massive Messenger Network,"To run an empire spanning continents, the Mongols built a relay system called the yam. Stations sat at regular spots along the main routes, each stocked with fresh horses, food, and shelter. A messenger could ride hard, swap to a rested horse, and keep going — moving news hundreds of miles in a day. It let rulers send orders and get reports across vast distances fast. In an age before any technology, it was one of the world's fastest information systems.",Riders could carry news hundreds of miles in a single day.,"history,mongol-empire,messenger,communication",39,9,false,
mongol-empire-kublai-khan,history,Mongol Empire,Kublai Khan Ruled China,"Kublai Khan, a grandson of Genghis Khan, did what his ancestors had long wanted: he conquered all of China. In 1271 he founded the Yuan dynasty and ruled China directly as emperor, mixing Mongol power with Chinese government. Under him, the empire welcomed foreign traders, including the Venetian Marco Polo. He built a grand capital near modern Beijing and trade flourished. It was the first time a foreign people ruled a unified China.",Genghis Khan's grandson became China's emperor.,"history,mongol-empire,kublai-khan,yuan-dynasty",38,10,false,
silk-road-not-one-road,history,Silk Road,The Silk Road Wasn't Just One Road,"Despite the name, the Silk Road was never a single road. It was a sprawling web of land and sea routes connecting China to Central Asia, the Middle East, Africa, and Europe. Travelers picked different branches depending on weather, politics, and what they carried, crossing deserts, mountains, and market towns. The name itself wasn't coined until the 1800s. Picturing a network instead of one road shows just how connected the ancient world really was.",It was a web of routes — and the name is only 150 years old.,"history,silk-road,trade,asia",38,10,false,
silk-road-few-travelers,history,Silk Road,Few People Traveled the Entire Route,"The Silk Road linked China to Europe, but almost no one traveled the whole way. Instead, goods changed hands again and again, passing from one local trader to the next across thousands of miles. A bolt of silk might be traded a dozen times before reaching a distant market, getting pricier each time. Most people only knew their own stretch of the route. So luxuries arrived in places whose people had no idea where they came from.",A bolt of silk might be traded a dozen times along the way.,"history,silk-road,merchants,trade",39,10,false,
silk-road-buddhism,history,Silk Road,Buddhism Reached China Along the Silk Road,"The Silk Road carried far more than silk and spices — it spread ideas, including Buddhism. Born in India, the religion traveled the trade routes with merchants and missionaries until it reached China and took deep root. Along the way, travelers built monasteries and carved stunning cave temples near the trading paths. Over centuries, Buddhism reshaped the spiritual life of much of East Asia. It shows how trade routes could change beliefs, not just economies.",The road carried a religion as well as silk and spices.,"history,silk-road,buddhism,religion",38,10,false,
silk-road-black-death,history,Silk Road,The Black Death May Have Traveled the Silk Road,"The routes that carried silk and ideas may also have carried one of history's deadliest diseases. In the 1300s, the Black Death swept across Asia and Europe, and many historians think it traveled the Silk Road. Fleas on rats could hide among trade goods and caravan supplies, spreading the plague from place to place. As merchants moved, the disease moved with them, eventually killing a huge share of Europe. The same links that enabled trade could also spread devastation.",The same routes that moved silk may have moved the plague.,"history,silk-road,black-death,plague",39,10,false,
silk-road-marco-polo,history,Silk Road,Marco Polo Traveled the Silk Road,"Of all the Silk Road's travelers, few became as famous as Marco Polo. In the late 1200s, the young Venetian journeyed across Asia with his family and spent years serving the Mongol ruler Kublai Khan. Back home, he described the wonders he'd seen — huge cities, strange customs, great riches — in a wildly popular book. His stories fascinated Europeans and fed their hunger to see the East. True or not, his tales inspired later explorers.",His travel stories inspired explorers for generations.,"history,silk-road,marco-polo,mongols",39,10,false,
french-revolution-louis-xvi,history,French Revolution,A King Was Executed by Guillotine,"In one of the most shocking moments of the French Revolution, the people executed their own king. Louis XVI, once seen as a ruler chosen by God, was put on trial for betraying the nation and sentenced to death. In January 1793, he was beheaded by guillotine before a huge crowd in Paris. Killing a reigning king stunned the royal courts of Europe. It sent a clear message: no one, not even a king, stood above the nation.",Once thought chosen by God — beheaded before a crowd.,"history,french-revolution,louis-xvi,guillotine",38,10,false,
french-revolution-marie-antoinette,history,French Revolution,Marie Antoinette Was Executed Too,"Months after the king died, the Revolution claimed another royal life: Queen Marie Antoinette. Born an Austrian princess, she had become a symbol of royal excess, and revolutionaries blamed her for the monarchy's faults. She was tried, convicted, and sent to the guillotine in October 1793. Her death showed the Revolution spared no one tied to the old regime. Her fall from glittering palaces to the blade became one of the age's most famous tragedies.",The queen followed the king to the guillotine months later.,"history,french-revolution,marie-antoinette,guillotine",38,10,false,
french-revolution-american-war,history,French Revolution,The American Revolution Helped Trigger It,"One spark of the French Revolution came from across the Atlantic. France spent enormous sums helping the American colonies beat Britain, hoping to weaken its old rival. The plan worked abroad — but pushed France toward financial ruin. Crushing debt forced the king to raise taxes and call meetings that exposed deep divisions at home. Watching Americans throw off a king also inspired French reformers. By aiding one revolution, France helped set off its own.",France helped America win — and bankrupted itself doing it.,"history,french-revolution,american-revolution,economics",36,10,false,
french-revolution-bastille,history,French Revolution,The Storming of the Bastille Became a Symbol,"On July 14, 1789, an angry crowd in Paris stormed a fortress and prison called the Bastille. It held only a handful of prisoners, but it stood for the king's harsh power to jail people without trial. Seizing it became a bold act of defiance against the whole old order. The news electrified France and is often called the true start of the Revolution. Today, the storming of the Bastille is still a national holiday.","It held only a few prisoners, but it meant everything.","history,french-revolution,bastille,france",39,10,false,
french-revolution-reign-of-terror,history,French Revolution,Thousands Died During the Reign of Terror,"As the French Revolution grew more extreme, it entered a dark phase called the Reign of Terror. Between 1793 and 1794, leaders hunted anyone they suspected of betraying the cause — real or imagined. Tens of thousands were arrested, and many were guillotined after rushed trials. The push to “protect” the Revolution turned it against its own people, and even some leaders fell to the blade. It showed how a movement born from hope could spiral into fear.",The Revolution began devouring its own people.,"history,french-revolution,reign-of-terror,robespierre",38,10,false,
printing-press-korea-first,history,Printing Press,Movable Type Existed Before Gutenberg,"Gutenberg gets the credit, but movable type actually appeared in Asia centuries earlier. Chinese craftsmen tried movable characters as early as the 1000s, and Korea went further by making metal movable type. Korean printers were making books with cast metal type before Gutenberg built his press in Europe. The dream of reproducing text mechanically arose in different places independently. Gutenberg's genius wasn't the idea itself — it was building a system that could spread it across a continent.",Korea was casting metal type before Gutenberg was born.,"history,printing-press,korea,technology",40,10,false,
printing-press-gutenberg-bible,history,Printing Press,Gutenberg Printed His Bible Around 1455,"Around 1455, in the German city of Mainz, Johannes Gutenberg produced one of the most important books ever: the Gutenberg Bible. Using his new press and movable metal type, he made copies far faster and more consistent than hand-copying ever could. The pages were beautifully printed and often decorated by hand afterward, rivaling the finest manuscripts. It marked the dawn of mass-produced books in Europe. The Gutenberg Bible helped launch a revolution in sharing knowledge.",It looked so good it rivaled hand-copied manuscripts.,"history,printing-press,gutenberg,bible",38,10,false,
