id,categoryId,topic,headline,body,summary,tags,readTimeSeconds,funScore,featured,relatedFactIds
venus-hottest-planet,space,Venus,Venus Is Hotter Than Mercury,"Mercury is closer to the Sun, but Venus is the hottest planet of all. Its thick air is full of carbon dioxide, which traps heat like a blanket. The surface can pass 870°F — hot enough to melt lead. This runaway “greenhouse effect” turned Venus into a furnace. Scientists study it to learn how a planet's air can completely change its climate.",Mercury sits closer to the Sun — but Venus is hot enough to melt lead.,"space,venus,temperature,atmosphere,astronomy",39,10,false,
venus-day-longer-than-year,space,Venus,A Day on Venus Is Longer Than a Year,Venus spins incredibly slowly. One full turn takes about 243 Earth days. But Venus circles the Sun in just 225 Earth days. That means a single day on Venus lasts longer than its entire year. No other planet has this strange mismatch between its day and its year.,It spins so slowly that sunrise to sunrise outlasts a full lap around the Sun.,"space,venus,rotation,orbit,astronomy",38,10,false,
venus-backwards-rotation,space,Venus,Venus Spins Backward,"Most planets spin the same way, but Venus turns the opposite direction. If you stood on its surface, the Sun would rise in the west and set in the east. Scientists aren't sure why. One idea is that a giant crash long ago flipped the planet's spin. It's one of the strangest motions in the solar system.","If you stood on Venus, the Sun would rise in the west.","space,venus,rotation,planets,astronomy",38,10,false,
venus-crushing-pressure,space,Venus,The Pressure on Venus Could Crush a Submarine,"The air on Venus is incredibly heavy. At the surface, it presses down more than 90 times harder than Earth's air. That's like being nearly a mile under the ocean. Mixed with the extreme heat, it makes Venus one of the deadliest places in the solar system. Most landers have survived only a couple of hours there.",Standing there would feel like being a mile under the ocean.,"space,venus,atmosphere,pressure,astronomy",38,10,false,
venus-clouds-acid,space,Venus,Venus Has Clouds Made of Acid,Venus is wrapped in thick clouds made of sulfuric acid. They bounce back so much sunlight that Venus is one of the brightest things in our night sky. But those same clouds help make the planet deadly. Scientists still study them closely. A few have even wondered if tiny life could float high in the cloud tops.,The clouds that make it shine are made of acid — and may hide microbes.,"space,venus,clouds,atmosphere,astronomy",39,10,false,
mars-planet-of-robots,space,Mars,Mars Is Entirely Inhabited by Robots,"Mars is the only world we know that is run entirely by robots. No human has ever set foot there. Instead, rovers like Spirit, Opportunity, Curiosity, and Perseverance have explored it for decades. They take photos, study rocks, and hunt for clues about Mars's past. In a way, Mars is already inhabited — just not by people.",No human has ever stood there — yet it's been busy with visitors for decades.,"space,mars,robots,nasa,exploration",38,10,false,"mars-pathfinders-for-humans,mars-most-explored-world"
mars-once-warmer-and-wetter,space,Mars,Mars Used to Be Warmer and Wetter,"Mars is cold and dry today, but it wasn't always. Rovers and orbiters have found dried-up riverbeds, old lakebeds, and minerals that only form in water. Billions of years ago, Mars likely had thicker air and a warmer climate with liquid water. Figuring out how it changed so much helps scientists understand how planets — including Earth — can transform.",The dry red desert once had rivers and lakes.,"space,mars,climate,history,planetary-science",39,10,false,"mars-search-for-life,mars-two-rovers-billions-of-years"
mars-search-for-life,space,Mars,Mars Might Have Once Had Life,"Is there life beyond Earth? Mars is one of the best places to look. Long ago it had lakes, rivers, and a friendlier climate. Now scientists scan its rocks and soil for chemical “fingerprints” that tiny microbes might leave behind. Nothing has been found yet. But every mission brings new clues.","If those ancient lakes held microbes, we may still find the traces.","space,mars,life,microbes,science",41,10,false,"mars-once-warmer-and-wetter,mars-two-rovers-billions-of-years"
mars-ai-driving,space,Mars,A Rover Has Used AI to Drive on Another Planet,"Perseverance was the first rover to use artificial intelligence to drive itself on another planet. Instead of waiting for every command from Earth, it can study the ground and choose its own route. That lets it travel farther and faster across rough land. It matters because messages between Earth and Mars take minutes to arrive. Future missions may rely on the same trick.",It doesn't wait for Earth — it picks its own path.,"space,mars,ai,perseverance,technology",40,10,false,"mars-planet-of-robots,mars-pathfinders-for-humans"
mars-maven-outlived-mission,space,Mars,A One-Year Mission Lasted More Than Eleven Years,"NASA's MAVEN spacecraft was built to study Mars for just one year. Instead, it has kept working for more than eleven. In that time, it helped explain how Mars slowly lost most of its air and turned into a cold desert. The bonus years gave scientists far more data than they ever expected.","Built to last 12 months, it's still working after more than a decade.","space,mars,maven,spacecraft,atmosphere",38,8,false,"mars-most-explored-world,mars-once-warmer-and-wetter"
asteroids-older-than-earth,space,Asteroids,Asteroids Are Older Than Earth,"Asteroids are leftovers from the birth of the solar system, about 4.6 billion years ago. They formed from the same cloud of gas and dust as the Sun and planets, but never grew into worlds. Because they've barely changed since then, they hold clues about how everything began. Scientists call them time capsules from before Earth existed.",These space rocks were around before our planet even formed.,"space,asteroids,solar-system,formation,history",39,10,false,"asteroids-main-belt,asteroids-less-mass-than-moon"
asteroids-less-mass-than-moon,space,Asteroids,All the Asteroids Together Weigh Less Than the Moon,"There are millions of asteroids in the solar system, but together they don't add up to much. If you squished every known asteroid into one ball, it would still weigh less than our Moon. Most of that weight sits in just a few big ones, like Ceres and Vesta. It shows just how empty space really is.","Millions of space rocks, and together they still can't outweigh the Moon.","space,asteroids,moon,mass,solar-system",40,10,false,"asteroids-older-than-earth,asteroids-size-range"
asteroids-dart-changed-orbit,space,Asteroids,Humans Have Successfully Moved an Asteroid,"In 2022, NASA crashed a spacecraft into a small asteroid called Dimorphos on purpose. It worked: the asteroid's path actually changed. It was the first time humans ever moved an object in space. The mission, called DART, was a test of how we might protect Earth from a dangerous asteroid one day. It was a huge milestone.","In 2022, we crashed a spacecraft into one on purpose — and it worked.","space,asteroids,dart,planetary-defense,nasa",42,10,false,"asteroids-planetary-defense,asteroids-near-earth-tracking"
asteroids-planetary-defense,space,Asteroids,NASA Has a Planetary Defense Office,"NASA really does have a Planetary Defense office. Its job is to find and track space rocks that could come near Earth. Using powerful telescopes and computer models, scientists map out asteroid paths years or even decades ahead. The good news: no large asteroid is on a collision course right now. Spotting threats early would give us time to act.",There's a real team whose job is watching the skies for incoming rocks.,"space,asteroids,planetary-defense,nasa,earth",39,10,false,"asteroids-dart-changed-orbit,asteroids-near-earth-tracking"
asteroids-bennu-mystery,space,Asteroids,One Asteroid Completely Surprised NASA,"When NASA's OSIRIS-REx reached the asteroid Bennu, scientists expected a smooth surface. Instead, they found it covered in jagged rocks and boulders. The surprise forced engineers to rethink how the spacecraft would grab a sample. Bennu was a good reminder that even small space rocks can catch experts off guard.",NASA expected a smooth surface. It found a boulder-covered mess.,"space,asteroids,bennu,osiris-rex,nasa",40,9,false,"asteroids-robotic-exploration,asteroids-dart-changed-orbit"
exoplanets-more-than-stars,space,Exoplanets,There Are More Planets Than Stars in Our Galaxy,"Planets are so common that the Milky Way may hold more planets than stars. Since our galaxy has hundreds of billions of stars, that's a staggering number of worlds. Scientists used to think planets might be rare. Now it looks like almost every star has them. Earth is just one planet among an enormous crowd.",Our galaxy may hold more worlds than it has stars.,"space,exoplanets,milky-way,stars,astronomy",39,10,false,"exoplanets-6000-confirmed,exoplanets-billions-exist"
exoplanets-6000-confirmed,space,Exoplanets,"We've Confirmed More Than 6,000 Alien Worlds","The first planet around a Sun-like star was found in the 1990s. Since then, scientists have confirmed more than 6,000 worlds beyond our solar system. They come in wild variety — some bigger than Jupiter, some about the size of Earth. And these are only the ones we've found so far. Many more are still out there waiting.",And that's just the handful we've managed to spot so far.,"space,exoplanets,nasa,astronomy,planets",39,10,false,"exoplanets-more-than-stars,exoplanets-billions-exist"
exoplanets-rogue-planets,space,Exoplanets,Some Planets Wander Through Space Alone,"Not every planet circles a star. Some, called rogue planets, drift alone through space with no sun at all. Scientists think many were flung out of their original solar systems long ago. With no nearby star, these worlds get no warmth or light. They're among the strangest, darkest places we can imagine.","No star, no sunrise — just endless dark.","space,exoplanets,rogue-planets,astronomy,space",37,10,false,"exoplanets-strange-worlds,exoplanets-billions-exist"
exoplanets-strange-worlds,space,Exoplanets,Scientists Have Found Lava Worlds and Styrofoam Worlds,"Alien planets are far stranger than anyone guessed. Scientists have found worlds with oceans of molten rock, planets made mostly of iron, and one so light it's compared to Styrofoam. Some race around their star in just a few hours. Others drift alone in the dark. The universe is full of worlds that stretch the imagination.",Some are oceans of lava; one is so light it's compared to Styrofoam.,"space,exoplanets,lava-worlds,astronomy,strange",42,10,false,exoplanets-rogue-planets
exoplanets-trappist-seven-worlds,space,Exoplanets,One Star Has Seven Earth-Sized Planets,"A star called TRAPPIST-1 has seven planets, all about the size of Earth. Several sit in the “just right” zone where water could stay liquid — exactly where life might be possible. It's about 40 light-years away and one of the most studied star systems we know. It shows that solar systems can look very different from ours.",And several sit in the zone where water could stay liquid.,"space,exoplanets,trappist-1,planets,astronomy",38,10,false,"exoplanets-closest-four-light-years,exoplanets-goldilocks-zone"
comets-giant-heads,space,Comets,A Comet's Glowing Head Can Become Bigger Than a Planet,"As a comet nears the Sun, its frozen gases heat up and burst out as a glowing cloud called a coma. The solid core can be small, but the coma around it can swell bigger than many planets. The Sun's heat drives the whole show. These giant glowing heads are why comets have amazed people for thousands of years.",Heat puffs its frozen core into a glowing cloud wider than a planet.,"space,comets,coma,astronomy,sun",40,10,false,"comets-million-mile-tails,comets-small-town-size"
comets-million-mile-tails,space,Comets,Comet Tails Can Stretch for Millions of Miles,"A comet's tail forms when sunlight and solar particles blow gas and dust off its core. Strangely, the tail always points away from the Sun, not behind the comet. It can stretch for millions of miles. Yet it's so thin and empty that it holds almost nothing. These glowing streaks have inspired myths for ages.",It always points away from the Sun — never trailing behind.,"space,comets,tails,solar-system,astronomy",38,10,false,"comets-giant-heads,comets-small-town-size"
comets-spin-reversal,space,Comets,A Comet Was Seen Reversing Its Spin for the First Time,"Using the Hubble Telescope, astronomers spotted the first comet known to slow its spin and then reverse direction. They think jets of gas shooting from its surface gradually changed how it turned. It showed that comets aren't dead rocks — they're active and can change in surprising ways.","Jets of gas slowly spun it down, then turned it the other way.","space,comets,hubble,rotation,astronomy",41,10,false,"comets-interstellar-visitors,comets-billions-exist"
comets-shoemaker-jupiter,space,Comets,A Comet Once Crashed Into Jupiter,"In 1994, people watched a comet named Shoemaker-Levy 9 smash into Jupiter. The impacts left dark scars in Jupiter's clouds that were visible through telescopes on Earth. It was one of the most dramatic events ever seen in the solar system. It also proved that big collisions still happen today.","In 1994, the world watched the scars appear from Earth.","space,comets,jupiter,shoemaker-levy,astronomy",40,10,false,"comets-interstellar-visitors,comets-million-mile-tails"
comets-oumuamua-first,space,Comets,'Oumuamua Was Humanity's First Known Interstellar Visitor,"In 2017, scientists spotted ‘Oumuamua — the first object ever seen passing through our solar system from another star. Its odd shape and strange motion sparked huge debate. Unlike normal comets, it came from far beyond our Sun and had traveled millions of years to reach us. It opened a whole new field: studying visitors from other star systems.",It spent millions of years crossing space before passing through our system.,"space,comets,oumuamua,interstellar,astronomy",40,10,false,"comets-interstellar-visitors,comets-spin-reversal"
dwarf-planets-hundreds-more,space,Dwarf Planets,Scientists Think Hundreds More Dwarf Planets Exist,"Only five dwarf planets are officially recognized, but scientists think hundreds more are out there. Many likely orbit far past Neptune, in an icy zone called the Kuiper Belt. They're hard to spot because they're small and incredibly far away. As telescopes improve, many more should turn up.",Only five are official — but hundreds may be hiding past Neptune.,"space,dwarf-planets,discovery,astronomy,solar-system",37,10,false,
dwarf-planets-haumea-fast-spin,space,Dwarf Planets,Haumea Is One of the Fastest-Spinning Worlds Known,"Haumea is one of the strangest worlds out there. It spins so fast that it's been stretched into an oval, like an egg, instead of a ball. One full turn takes only about four hours. That makes it one of the fastest-spinning large objects we know. Its shape hints at a giant crash billions of years ago.",It spins so fast it's been stretched into an egg shape.,"space,haumea,dwarf-planets,rotation,astronomy",38,10,false,
dwarf-planets-planet-definition,space,Dwarf Planets,Pluto Lost Planet Status Because It Couldn't Clear Its Orbit,"In 2006, scientists made an official rule: a planet has to sweep its orbit clear of other objects. Pluto couldn't — it shares its space with many icy bodies out past Neptune. So it was renamed a dwarf planet. The choice upset a lot of people and is still argued about today.",It still shares its lane with crowds of icy objects.,"space,pluto,dwarf-planets,astronomy,history",40,9,false,
dwarf-planets-eris-size,space,Dwarf Planets,Eris Helped Redefine What a Planet Is,"When Eris was discovered in 2005, it raised a tricky question. Eris is about the same size as Pluto — so if Pluto counted as a planet, shouldn't Eris too? Instead of adding a planet, scientists made a brand-new group: dwarf planets. That decision is what bumped Pluto out of the planet club a year later.",Finding a world Pluto's size forced a hard question.,"space,eris,dwarf-planets,pluto,astronomy",38,10,false,
dwarf-planets-definition-created-2006,space,Dwarf Planets,The Official Planet Definition Didn't Exist Until 2006,"It sounds odd, but for most of history there was no exact definition of a planet. That changed in 2006, when astronomers finally set official rules. The same rules created the dwarf planet group and changed how we sort worlds. It's proof that even a familiar word like “planet” can change as science learns more.","For most of history, nobody had agreed on what 'planet' even meant.","space,dwarf-planets,history,astronomy,planets",36,10,false,
jupiter-thousand-earths,space,Jupiter,One Thousand Earths Could Fit Inside Jupiter,"Jupiter is by far the biggest planet in our solar system. If it were hollow, about 1,000 Earths could fit inside. Yet it's not solid — it's made mostly of hydrogen and helium, like the Sun. Its huge gravity tugs on asteroids and comets all around it. Studying Jupiter helps scientists learn how giant planets form.",Our whole planet would be a marble inside it.,"space,jupiter,planets,size,astronomy",38,10,false,
jupiter-more-mass-than-all-planets,space,Jupiter,Jupiter Is More Massive Than All the Other Planets Combined,"Jupiter is more than twice as heavy as all the other planets combined. That enormous mass gives it powerful gravity. Scientists think it formed early and helped shape where the other planets ended up. Its pull also grabs or flings away passing comets and asteroids. Without Jupiter, our solar system might look very different.","Add up every other planet, and Jupiter still wins — twice over.","space,jupiter,mass,planets,astronomy",37,10,false,
jupiter-shortest-day,space,Jupiter,Jupiter Has the Shortest Day in the Solar System,"Jupiter is huge, but it spins incredibly fast. One full day there lasts only about 10 hours — the shortest of any planet. That speed makes Jupiter bulge out at its middle and helps create its famous striped clouds. It also powers the planet's strong magnetic field. Sunrises come fast on Jupiter.",The biggest planet also spins the fastest — a day is under 10 hours.,"space,jupiter,rotation,time,astronomy",35,10,false,
jupiter-ninety-five-moons,space,Jupiter,Jupiter Has 95 Officially Recognized Moons,"Jupiter has one of the biggest moon families in the solar system — 95 recognized so far. They range from tiny lumps of rock to giant moons bigger than the planet Mercury. A few, like Europa and Ganymede, are top targets for future missions. Together, Jupiter and its moons act like a mini solar system.",One of them is bigger than the planet Mercury.,"space,jupiter,moons,solar-system,astronomy",36,10,false,
jupiter-great-red-spot,space,Jupiter,Jupiter's Great Red Spot Is a Giant Storm,"Jupiter's Great Red Spot is a giant storm — big enough to swallow the entire Earth. It has been spinning for centuries, far longer than any storm on our planet. Scientists still wonder why it lasts so long and why it's slowly shrinking. It shows that weather on other worlds can be wilder than anything here.",A storm so big it could swallow Earth — and it's raged for centuries.,"space,jupiter,storms,great-red-spot,astronomy",38,10,false,
saturn-less-dense-than-water,space,Saturn,Saturn Would Float in Water,"Saturn is the lightest planet for its size. It's so spread out that, if you had a big enough bathtub, Saturn would actually float. That's because it's a giant ball of hydrogen and helium gas, not solid rock. It's a fun way to picture just how different gas giants are from rocky worlds like Earth.",Find a big enough bathtub and the whole planet would bob on top.,"space,saturn,density,gas-giants,astronomy",36,10,false,
saturn-titan-lakes,space,Saturn,One of Saturn's Moons Has Lakes and Rain,"Titan, Saturn's largest moon, is the only place besides Earth with lakes and rivers on its surface. But they're not water — they're liquid methane and ethane. Titan even has clouds and rain, with weather cycles a bit like ours. Despite its freezing cold, scientists call it one of the most Earth-like spots in the solar system.",But the rain isn't water — it's liquid methane.,"space,saturn,titan,lakes,astronomy",40,10,false,
saturn-enceladus-ocean,space,Saturn,A Small Moon May Hide an Ocean Beneath Its Ice,"Saturn's little moon Enceladus seems to hide a whole ocean under its icy shell. Spacecraft spotted giant geysers spraying water out into space, likely fed by that hidden sea. Since life needs water, Enceladus is now one of the best places to search for it. A tiny frozen moon may hold a big secret.",Geysers blast its hidden sea straight out into space.,"space,saturn,enceladus,ocean,life",40,10,false,
saturn-cassini-grand-finale,space,Saturn,NASA Ended Cassini With a Controlled Crash,"After more than 13 years exploring Saturn, NASA flew its Cassini spacecraft straight into the planet in 2017. Why crash it on purpose? To make sure it never drifted into moons like Enceladus or Titan and contaminated them. Along the way, Cassini sent back stunning images and found signs of hidden oceans. Many call it one of the greatest space missions ever.","After 13 years, NASA flew it straight into the planet — on purpose.","space,saturn,cassini,spacecraft,nasa",39,10,false,
saturn-winds-faster-than-hurricanes,space,Saturn,Saturn's Winds Are Faster Than Earth's Strongest Hurricanes,"Saturn has some of the fiercest weather around. Winds near its equator can blow over 1,000 miles per hour — far faster than the strongest hurricane on Earth. Those winds shape the planet's banded clouds. Scientists study them to learn how giant planets work. It's a reminder that weather out there can be far more violent than ours.","Winds there top 1,000 mph — Earth's worst storms can't compare.","space,saturn,winds,weather,astronomy",39,10,false,
uranus-sideways-planet,space,Uranus,Uranus Rotates on Its Side,"Uranus is tipped over almost completely — about 98 degrees — so it rolls around the Sun on its side. Scientists think a massive crash early on knocked it over. Because of the tilt, its seasons are extreme: one pole can face the Sun for years while the other sits in darkness. It's one of the oddest planets we've found.",It rolls around the Sun like a tipped-over ball.,"space,uranus,rotation,planets,astronomy",38,10,false,
uranus-coldest-planet,space,Uranus,Uranus Is the Coldest Planet in the Solar System,"Neptune is farther from the Sun, but Uranus is actually the coldest planet. Temperatures can drop to around -371°F. Strangely, Uranus gives off almost no heat of its own, unlike the other giant planets. Scientists still don't know why. It's one of the biggest mysteries about this icy world.","Neptune is farther out, yet Uranus is the colder one.","space,uranus,temperature,ice-giants,astronomy",37,10,false,
uranus-discovered-by-telescope,space,Uranus,Uranus Was the First Planet Discovered With a Telescope,"For thousands of years, people only knew the planets they could see with their eyes. Then in 1781, William Herschel spotted Uranus through a telescope. At first he thought it was a comet, until others realized it was a whole new planet. The find pushed the edge of the known solar system farther out than ever before.","For all of history before 1781, no one knew it was there.","space,uranus,history,telescope,astronomy",38,10,false,
uranus-season-decades,space,Uranus,A Season on Uranus Can Last More Than 20 Years,"Uranus is tipped on its side and takes 84 Earth years to circle the Sun. That makes each season last about 21 years. For all that time, one half of the planet can bask in sunlight while the other half sits in darkness. These super-long seasons are unlike anything on Earth.",Imagine 21 straight years of summer — or darkness.,"space,uranus,seasons,orbit,astronomy",36,10,false,
uranus-voyager-2,space,Uranus,Only One Spacecraft Has Ever Visited Uranus,"Only one spacecraft has ever visited Uranus: NASA's Voyager 2, which flew past in 1986. That single visit gave us our only close-up photos of the planet and its moons. No mission has returned since, so many mysteries remain. Even though it's a major planet, Uranus is still mostly unexplored.",Our only close-up came during a single flyby in 1986.,"space,uranus,voyager-2,exploration,astronomy",39,10,false,
pluto-heart-shape,space,Pluto,Pluto Has a Giant Heart on Its Surface,"When NASA's New Horizons flew past Pluto in 2015, it spotted something amazing: a giant, heart-shaped region on the surface. Scientists named it Tombaugh Regio, and it's now one of the most famous sights in the solar system. The “heart” is filled with frozen nitrogen that slowly flows and reshapes the land. Pluto went from a fuzzy dot to a living world.","A spacecraft revealed a heart of frozen ice, miles wide.","space,pluto,new-horizons,tombaugh-regio,astronomy",40,10,false,
pluto-blue-sky,space,Pluto,Pluto Has a Blue Sky,"One of New Horizons' biggest surprises was Pluto's blue sky. Sunlight hitting tiny haze particles high above the surface gives the sky its color — a bit like on Earth. That's stunning for a world so far from the Sun. It showed that even tiny, frozen places can have surprisingly rich atmospheres.","Billions of miles from the Sun, its sky still glows blue.","space,pluto,atmosphere,new-horizons,astronomy",39,10,false,
