id,categoryId,topic,headline,body,summary,tags,readTimeSeconds,funScore,featured,relatedFactIds
indus-city-planning,ancient-civilizations,Indus Valley Civilization,Indus Cities Were Remarkably Well Planned,"The people of the Indus Valley were extraordinary city planners, far ahead of their time. Their towns were laid out on neat grids, with streets crossing at right angles and buildings made from standardized baked bricks. Cities had public wells, granaries, and even large bathing areas, all carefully arranged. This kind of planning points to strong organization and shared standards across great distances. Much of the world wouldn't match it for thousands of years.","Streets on a neat grid, thousands of years before it was common.","indus,engineering,cities,architecture",40,10,false,
indus-indoor-plumbing,ancient-civilizations,Indus Valley Civilization,Many Homes Had Indoor Plumbing,"Thousands of years ago, the Indus Valley Civilization had plumbing so advanced it seems modern. Many homes had private bathrooms, and wastewater drained through covered channels into sewers running under the streets. Some houses even had wells and bathing areas. This sanitation was far ahead of its time, and similar comforts wouldn't be common elsewhere for centuries. Indoor plumbing in such an ancient society shows these people valued cleanliness, health, and clever engineering.",Private bathrooms and covered sewers — thousands of years ago.,"indus,plumbing,engineering,technology",40,10,false,
indus-undeciphered-script,ancient-civilizations,Indus Valley Civilization,Nobody Has Deciphered the Indus Script,"The Indus Valley Civilization left behind a writing system no one can read. Found on small seals, pottery, and other objects, the script is made of symbols that have puzzled scholars for over a century. Unlike Egyptian or Mesopotamian writing, it has no known translation key, and the inscriptions are usually very short. Because we can't read it, much about these people's lives and beliefs stays unknown. It's one of archaeology's greatest unsolved mysteries.",We've stared at it for a century and still can't read it.,"indus,writing,mystery,archaeology",40,10,false,
indus-mysterious-decline,ancient-civilizations,Indus Valley Civilization,Nobody Knows Exactly Why the Indus Civilization Disappeared,"One of the great puzzles of the ancient world is why the Indus Valley Civilization faded away. After thriving for centuries, its great cities were slowly abandoned and its culture slipped into obscurity. Scholars suggest causes like climate change, shifting rivers, drought, or broken trade — but nothing is certain. Since the Indus script can't be read, the people left no clear record of what happened. The mystery still fascinates archaeologists searching for clues.",A thriving civilization faded — and left no explanation.,"indus,mystery,collapse,archaeology",39,10,false,
carthage-new-town-name,ancient-civilizations,Carthage,"Carthage Meant ""New Town""","Carthage was one of the great cities of the ancient Mediterranean, but its name had a surprisingly simple meaning. Britannica says it was traditionally founded by Phoenicians from Tyre in 814 BCE. Its Phoenician name was Kart-hadasht, meaning ""new town."" The date may have been exaggerated, though, because archaeology has not found anything there earlier than the late 8th century BCE.","One of the ancient world's greatest cities had a name that simply meant ""new town.""","ancient civilizations,carthage,phoenicians,mediterranean,tunisia",48,8,false,
carthage-mediterranean-bottleneck,ancient-civilizations,Carthage,"Carthage Was Built at a Mediterranean Bottleneck","Carthage became powerful partly because of where it sat. Britannica says the city was built on the Tunisian coast, where it could influence ships moving between Sicily and North Africa. Its harbor was safe, its peninsula was easy to defend, and it had access to the Mediterranean while being protected from many storms. Its spot near the Strait of Sicily made it a strategic bottleneck for east-west trade.","Carthage's location helped turn it from a port into a Mediterranean power.","ancient civilizations,carthage,mediterranean,trade,tunisia",52,10,false,
carthage-purple-dye-silver,ancient-civilizations,Carthage,"Carthage Made Money From Purple Dye and Silver","Carthage was famous for commerce more than art. Britannica says the city controlled much of the western trade in luxurious purple dye made from the murex shell. It also drew major revenue from silver mines in North Africa and southern Spain. Even in Roman times, Punic beds, cushions, mattresses, joinery, and furniture were seen as luxuries worth copying.","Carthage's wealth came from trade goods people wanted badly enough to copy and fight over.","ancient civilizations,carthage,punic,trade,purple dye,silver",50,9,false,
carthage-rome-burned-city,ancient-civilizations,Carthage,"Rome Burned Carthage After the Punic Wars","Carthage and Rome fought a long series of conflicts called the Punic Wars. Britannica says these wars ended with Carthage's complete defeat and the expansion of Roman control in the Mediterranean world. When Carthage finally fell in 146 BCE, the site was plundered and burned. That destruction fulfilled Cato the Elder's famous demand: ""Carthage must be destroyed.""","Rome's great rival was not just defeated. Its city was plundered and burned.","ancient civilizations,carthage,rome,punic wars,cato",48,10,false,
ancient-rome-small-town-empire,ancient-civilizations,Ancient Rome,"Rome Grew From a Small Town Into a Vast Empire","Ancient Rome began as a state centered on the city of Rome. Britannica says it grew over centuries from a small town on the Tiber River into one of history's most successful imperial powers. Its empire eventually reached England, much of continental Europe, northern Africa, Mediterranean islands, and parts of Asia west of the Euphrates. That rise made Rome one of the ancient world's biggest political transformations.","A small town by a river became an empire spread across Europe, Africa, and Asia.","ancient civilizations,ancient rome,roman empire,tiber river,empire",50,10,false,
ancient-rome-conquered-citizenship,ancient-civilizations,Ancient Rome,"Rome Made Conquered People Part of Its System","Rome did not grow only by defeating people. Britannica says that, unlike Greek city-states, Rome incorporated conquered peoples into its social and political system from early on. Allies and subjects who adopted Roman ways were eventually granted Roman citizenship. That helped Rome turn conquest into a much larger shared system, instead of keeping outsiders permanently outside political life.","Rome's power grew partly because some conquered people could eventually become Romans.","ancient civilizations,ancient rome,citizenship,roman republic,empire",48,9,false,
ancient-rome-borrowed-from-etruscans,ancient-civilizations,Ancient Rome,"Rome Borrowed Key Customs From the Etruscans","Rome's early culture did not develop in isolation. Britannica says early Rome was shaped by a multicultural environment and was strongly influenced by the Etruscans to the north. Roman religion borrowed from Etruscan beliefs and practices. Romans also adapted the alphabet through the Etruscans, and senior officials of the Roman Republic used Etruscan-style symbols such as the curule chair, purple-bordered toga, and fasces.","Some symbols of Roman power came from a neighboring culture Rome learned from.","ancient civilizations,ancient rome,etruscans,religion,alphabet",52,9,false,
ancient-rome-augustus-first-emperor,ancient-civilizations,Ancient Rome,"Augustus Became Rome's First Emperor","Rome was not always ruled by emperors. Britannica says the city passed from its legendary founding and regal period into the republic, then the empire. After the republic was destroyed by Julius Caesar's dictatorship, Augustus became the first Roman emperor. His system was called the principate because he presented himself as princeps, or first citizen, while ruling with revived republican institutions around him.","Rome's first emperor ruled through a system that still dressed itself in republican language.","ancient civilizations,ancient rome,augustus,roman empire,republic",50,9,false,
olmecs-pattern-for-maya-aztec,ancient-civilizations,Olmecs,"The Olmecs Helped Set the Pattern for Maya and Aztec Culture","The Olmecs were one of the great starting points of Mesoamerican civilization. Britannica calls them the first elaborate pre-Columbian civilization of Mesoamerica, flourishing from about 1200 to 400 BCE. They are thought to have set many of the basic patterns later seen in cultures of Mexico and Central America. That includes later civilizations such as the Maya and the Aztec.","Before the Maya and Aztec, the Olmecs helped shape the blueprint of Mesoamerican civilization.","ancient civilizations,olmecs,mesoamerica,maya,aztec",45,10,false,
olmecs-rubber-people-name,ancient-civilizations,Olmecs,"Olmec Means ""Rubber People""","The name Olmec has a surprisingly practical meaning. Britannica says it comes from the Nahuatl word Olmecatl, meaning ""rubber people"" or ""people of the rubber country."" The name was chosen because the Olmecs extracted latex from Panama rubber trees. They mixed it with juice from a local vine called moonflower to create rubber.","Their name points to a real material skill: making rubber from trees and vines.","ancient civilizations,olmecs,rubber,mesoamerica,nahuatl",45,9,false,
olmecs-colossal-stone-heads,ancient-civilizations,Olmecs,"The Olmecs Carved Giant Stone Heads","The Olmecs are especially famous for huge stone heads found at major sites such as San Lorenzo and La Venta. Britannica says 17 of these heads are known. They range from about 4.82 feet to 11.15 feet tall and have flat faces, full lips, and helmetlike headgear. Scholars generally think they are portraits of Olmec rulers.","Some Olmec ruler portraits were carved as stone heads taller than a person.","ancient civilizations,olmecs,colossal heads,san lorenzo,la venta",48,10,false,
olmecs-oldest-americas-writing,ancient-civilizations,Olmecs,"The Oldest Writing in the Americas May Be Olmec","A stone slab found near San Lorenzo may hold one of the oldest writing systems in the Americas. Britannica says the Cascajal stone is engraved with symbols that appear to be Olmec writing, sometimes called epi-Olmec or Isthmian. It dates to about 900 BCE. Other objects with glyphs have also helped scholars study the language, though many questions remain.","A carved stone slab may preserve writing from the Americas more than 2,900 years ago.","ancient civilizations,olmecs,writing,cascajal stone,archaeology",48,9,false,
minoans-first-high-civilization-crete,ancient-civilizations,Minoans,"Crete Had Europe's First High Civilization","The Minoans built a Bronze Age civilization on the island of Crete. Britannica says Crete became the foremost Bronze Age culture in the Aegean Sea and the first center of high civilization in that area. Minoan civilization flourished from about 3000 BCE to about 1100 BCE. It became known for great cities, palaces, trade, writing, and sophisticated art.","Europe's first high civilization rose on Crete thousands of years ago.","ancient civilizations,minoans,crete,bronze age,aegean",45,10,false,
minoans-bull-leaping-art,ancient-civilizations,Minoans,"Minoan Art Shows People Vaulting Over Bulls","One of the most famous Minoan images shows people vaulting over a bull. Britannica identifies the Toreador Fresco from Knossos as a Late Minoan painting that depicts young people bull-leaping. Bulls were a familiar motif in Minoan art. The ritual of bull-leaping, found on cult vases too, seems to have had a religious or magical basis.","Some Minoan art shows people performing a dramatic ritual leap over a bull.","ancient civilizations,minoans,bull leaping,knossos,crete",45,9,false,
minoans-vivid-palace-frescoes,ancient-civilizations,Minoans,"Minoan Palaces Were Full of Vivid Frescoes","Minoan civilization is remembered for art that still feels alive. Britannica says its sophisticated art included elaborate seals, pottery, and especially delicate, vibrant frescoes on palace walls. These paintings showed both everyday and religious scenes. Their subjects included magical gardens, monkeys, wild goats, and fancifully dressed goddesses tied to Minoan religion.","Palace walls on Crete were painted with gardens, animals, and goddesses instead of plain stone.","ancient civilizations,minoans,frescoes,crete,art",45,8,false,
minoans-spread-across-aegean,ancient-civilizations,Minoans,"Minoan Culture Spread Across the Aegean","Minoan civilization did not stay only on Crete. Britannica says that by about 1580 BCE, Minoan civilization began spreading across the Aegean to nearby islands and mainland Greece. Its influence appeared in Mycenaean culture, which began spreading through the Aegean around 1500 BCE. Later, mainland conquerors took over Crete, creating a fusion of Cretan and mainland skills.","Minoan influence helped shape the wider Aegean world before Crete's palace culture declined.","ancient civilizations,minoans,mycenaeans,aegean,crete",48,9,false,
hittites-middle-eastern-superpower,ancient-civilizations,Hittites,"The Hittites Became a Middle Eastern Superpower","The Hittites were an ancient Indo-European people who appeared in Anatolia near the beginning of the 2nd millennium BCE. Britannica says that by 1340 BCE, they had become one of the dominant powers of the Middle East. Their capital was Hattusa, in what is now Boğazköy, Turkey. From there, Hittite rulers expanded their control across much of Anatolia and northern Syria.","A people based in Anatolia grew into one of the major powers of the ancient Middle East.","ancient civilizations,hittites,anatolia,hattusa,middle east",48,9,false,
hittites-raided-babylon,ancient-civilizations,Hittites,"A Hittite King Raided Babylon","The Hittites did not stay locked inside Anatolia. Britannica says Mursilis I, grandson of Hattusilis I, raided down the Euphrates River to Babylon. Around 1590 BCE, that raid helped bring an end to the Amorite dynasty there. It was a dramatic sign of how far Hittite power could reach during the Old Kingdom.","A Hittite ruler reached Babylon by following the Euphrates and helped end a dynasty.","ancient civilizations,hittites,babylon,euphrates,anatolia",42,10,false,
hittites-kadesh-indecisive,ancient-civilizations,Hittites,"The Battle of Kadesh Ended Without a Clear Winner","The Hittites clashed with Egypt over control of Syria. Britannica says this struggle led to one of the greatest battles of the ancient world: the Battle of Kadesh in 1299 BCE. Ramses II claimed a great victory, but the result was probably indecisive. Sixteen years later, the Hittites and Egyptians made a peace treaty, a mutual defense pact, and a dynastic marriage.","One of the ancient world's biggest battles ended with both sides later choosing peace.","ancient civilizations,hittites,egypt,kadesh,ramses ii",50,9,false,
hittites-iron-age,ancient-civilizations,Hittites,"Hittites Helped Launch the Iron Age","The Hittites lived in Anatolia, a region rich in metals such as silver and iron. Britannica says that during the empire period, the Hittites developed iron-working technology. This helped initiate the Iron Age. That means their metalworking was not just useful for tools and weapons. It helped mark a major technological shift in human history.","Hittite metalworking helped push the ancient world toward the Iron Age.","ancient civilizations,hittites,iron age,anatolia,technology",45,10,false,
octopus-rice-grain-eggs,animals,Octopus,The World's Largest Octopus Starts Smaller Than a Grain of Rice,"The giant Pacific octopus is the largest octopus on Earth — yet it starts out almost impossibly tiny. When it hatches, the baby (called a paralarva) is smaller than a single grain of rice and drifts helplessly among the plankton. From there, it has to grow into a creature that can stretch many feet wide and weigh dozens of pounds. To do it, it eats constantly and grows fast over just a few years. Going from a speck to an ocean giant is one of nature's most amazing transformations.",The ocean giant hatches as a speck drifting in the plankton.,"animals,octopus,marine-life,ocean",39,10,false,
octopus-two-thousand-suction-cups,animals,Octopus,"Female Octopuses Have More Than 2,000 Suction Cups","An octopus's arms are covered in suction cups — a female giant Pacific octopus can have more than 2,000. But these aren't just for gripping. Each one is packed with sensors that let the octopus taste and feel whatever it touches. So an octopus basically explores its world by reaching out and sampling things with its arms. The cups also grip prey and pull it across the seafloor. It senses its surroundings in a way totally unlike ours.",Each cup can taste and feel whatever it touches.,"animals,octopus,biology,suction-cups",39,10,false,
octopus-open-jars,animals,Octopus,Octopuses Can Solve Puzzles and Open Jars,"Octopuses are some of the smartest invertebrates on Earth. In labs and aquariums, they've amazed scientists by solving puzzles, working through mazes, and even unscrewing jar lids to reach food. Some learn to recognize individual people — and some sneak out of their tanks for fun. That kind of problem-solving shows real curiosity in a creature so different from us. It's a reminder that clever minds can evolve in shapes we'd never expect.","They open jars, solve mazes, and sneak out of their tanks.","animals,octopus,intelligence,behavior",38,10,false,
octopus-color-blind,animals,Octopus,Octopuses Are Color-Blind Masters of Camouflage,"Here's a real head-scratcher: octopuses appear to be color-blind, yet they create stunningly accurate color camouflage. Even though they probably can't see color the way we do, an octopus can match the colors around it with incredible precision. Scientists still aren't sure how. Some think the skin itself may sense light and color. However it works, the octopus makes a perfect disguise out of colors it may never actually see.",They can't see color — but they match it perfectly anyway.,"animals,octopus,camouflage,science",40,10,false,
octopus-mothers-stop-eating,animals,Octopus,Mother Octopuses Sacrifice Themselves for Their Eggs,"A mother octopus shows devotion that ends in the ultimate sacrifice. After laying her eggs, she guards them tirelessly, cleaning them and fanning fresh water over them. During this long watch — which can last months — she stops eating entirely and slowly weakens. By the time the eggs hatch, the exhausted mother is usually near death, and she soon dies. She gives her own life so her babies have the best shot at survival.",She guards her eggs for months — and starves doing it.,"animals,octopus,reproduction,behavior",40,10,false,
elephants-twenty-two-month-pregnancy,animals,Elephants,Elephants Have the Longest Pregnancy of Any Mammal,"Elephants hold a remarkable record: the longest pregnancy of any mammal. A mother carries her calf for about 22 months — nearly two full years — before giving birth. That long stretch lets the calf's big brain and body develop fully first. When it's finally born, the calf already weighs around 200 pounds and can stand within hours. It shows just how much time and energy elephants pour into each baby.",Nearly two full years before a single calf is born.,"animals,elephants,pregnancy,mammals",41,10,false,
elephants-eighteen-hours-eating,animals,Elephants,Elephants Spend Most of the Day Eating,"Feeding such a huge body is nearly a full-time job. Elephants can spend up to 18 hours a day eating, grazing and browsing almost nonstop from morning to night. Their plant diet isn't very rich in nutrients, so they have to eat enormous amounts just to get enough energy. That leaves little time for rest. Watching an elephant strip leaves and bark hour after hour shows the effort it takes to fuel the largest land animal.","Up to 18 hours a day, nearly nonstop.","animals,elephants,food,behavior",38,10,false,
elephants-matriarchs,animals,Elephants,Elephant Families Are Led by Females,"Elephant society runs on female leadership. A herd is usually related females and their young, all led by the oldest, most experienced female — the matriarch. She decides where to find water and food, when to move, and how to keep everyone safe. Her decades of memory can be life-or-death during a drought or a threat. The others rely on her wisdom. Among elephants, age and knowledge are treasured above all.",The oldest female's memory can save the whole herd.,"animals,elephants,social-behavior,family",38,10,false,
elephants-footprint-ecosystems,animals,Elephants,An Elephant Footprint Can Become an Ecosystem,"An elephant's footprint can be far more than a mark in the mud. When elephants step through wet ground, their heavy feet leave deep prints that fill with rainwater. These little pools can become tiny habitats — homes for frogs, insects, and other small creatures, and even places where certain plants thrive. So a single footprint can support a miniature web of life. Even just walking turns these giants into engineers of their world.",A single deep footprint can shelter frogs and insects.,"animals,elephants,ecosystems,nature",38,10,false,
elephants-find-water,animals,Elephants,Elephants Can Dig for Water During Droughts,"Elephants are amazingly resourceful in dry seasons. When water gets scarce, they use their tusks, trunks, and feet to dig into dry riverbeds and reach water hidden below. Their excellent memory helps them recall faraway water sources across their range. The holes they dig can also help other thirsty animals survive. That makes elephants vital to the whole community of wildlife around them — their cleverness and memory keep many creatures alive.",They dig wells that other thirsty animals use too.,"animals,elephants,survival,drought",40,10,false,
dolphins-signature-whistle,animals,Dolphins,Every Dolphin Has Its Own Name,"In a way, every dolphin has its own name. Each one makes a unique sound called a signature whistle to identify itself. Dolphins call out these whistles to announce who they are — and they'll even copy a specific friend's whistle to get its attention, like calling someone by name. It helps them keep track of each other in the wide, murky ocean. Scientists think dolphins remember friends' whistles for years.",And they'll copy a friend's whistle to 'call' them by name.,"animals,dolphins,communication,ocean",41,10,false,
dolphins-echolocation,animals,Dolphins,Dolphins Use Natural Sonar,"Dolphins hunt and navigate using a natural sonar called echolocation. They make rapid clicking sounds that travel through the water, bounce off objects, and come back as echoes. By listening to those echoes, a dolphin can sense the size, shape, distance, and even movement of things around it. This is super useful in dark or cloudy water where eyes alone would fail. Using sound to “see” is one of nature's most ingenious tricks.",They 'see' with sound when the water is too dark for eyes.,"animals,dolphins,echolocation,ocean",40,10,false,
dolphins-echoes,animals,Dolphins,Dolphins Can Hear the Shape of Objects,"With echolocation, dolphins can basically hear the shape of things. When their clicks bounce back, a dolphin's brain turns the echoes into a detailed picture of its surroundings. It can tell if something is big or small, hard or soft, even buried under sand. The sense is so precise that dolphins can tell different fish apart without seeing them. They paint images out of echoes — a way of sensing the world we can barely imagine.",They can tell fish apart without ever seeing them.,"animals,dolphins,echolocation,senses",40,10,false,
dolphins-skin-shedding,animals,Dolphins,Dolphins Shed Their Skin Every Two Hours,"Dolphins stay fast by constantly renewing their skin. A dolphin may shed and replace its outer skin layer as often as every two hours — far faster than we do. That keeps the surface smooth and free of buildup, which cuts drag in the water. A clean, streamlined body lets them glide quickly and easily. Even the surface of a dolphin is fine-tuned for a life of speed.",It keeps them smooth enough to slip through the water.,"animals,dolphins,biology,mammals",41,10,false,
dolphins-mud-rings,animals,Dolphins,Dolphins Hunt Using Mud Traps,"Some dolphins have invented a brilliant hunting trick using mud. Working in a group, they swim in a tight circle near the seafloor, beating their tails to stir up a swirling ring of mud around a school of fish. Scared by the cloud, the fish leap out of the water — right into the waiting dolphins' mouths. It takes teamwork and an understanding of how the fish will react. Certain dolphin groups pass the trick down to each other.",They stir up a ring of mud to scare fish into the air.,"animals,dolphins,hunting,teamwork",40,10,false,
penguins-fathers-incubate,animals,Penguins,Penguin Fathers Balance Eggs on Their Feet,"Emperor penguin dads have one of the toughest jobs in nature. After the female lays a single egg, she passes it to the male and heads to sea to feed. The father balances that egg on top of his feet, tucked under a warm fold of skin, to shield it from the brutal Antarctic cold. For about two months, he holds it there without setting it down — often going the whole time without food. His devotion gives the egg its best shot at survival.",He holds it for two months without ever setting it down.,"animals,penguins,reproduction,birds",42,10,false,
