id,categoryId,topic,headline,body,summary,tags,readTimeSeconds,funScore,featured,relatedFactIds
seahorses-no-stomachs,ocean-life,Seahorses,Seahorses Don't Have Stomachs,"Unlike most animals, seahorses don't have a true stomach — just a simple digestive tube. Food passes through so quickly that they can't store nutrients for long. As a result, seahorses have to eat almost constantly to get enough energy. This odd digestion shapes nearly everything they do. It's why these tiny fish spend so much of their lives hunting for food.",Food rushes through so fast they must eat almost constantly.,"ocean-life,seahorses,digestion,biology",35,10,false,
seahorses-hundreds-of-babies,ocean-life,Seahorses,Seahorses Can Release Hundreds of Babies at Once,"When a male seahorse gives birth, he can release dozens or even hundreds of babies in just minutes. The tiny newborns are about the size of jelly beans and start life on their own in the open ocean. Having so many young boosts the odds that at least a few survive to grow up. It's a common strategy among ocean animals. Watching hundreds of mini seahorses pour out is one of nature's wildest sights.","Newborns the size of jelly beans, hundreds at a time.","ocean-life,seahorses,birth,babies",35,10,false,
seahorses-vacuum-snouts,ocean-life,Seahorses,Seahorses Use Their Snouts Like Vacuum Cleaners,"Seahorses feed with long, tube-shaped snouts that work like tiny vacuum cleaners. By quickly sucking in water, they slurp up small crustaceans and other drifting prey. This lets them eat without chasing their food. Combined with having no stomach, it's why they spend so much time eating. Their feeding trick is simple but very effective.",They slurp up prey through a long tube-shaped snout.,"ocean-life,seahorses,feeding,snout",35,10,false,
sea-turtles-lay-eggs-on-land,ocean-life,Sea Turtles,Sea Turtles Live Mostly in the Ocean but Lay Eggs on Land,"Sea turtles spend nearly their whole lives in the ocean, but adult females come ashore to lay their eggs. Sandy nesting beaches give the developing hatchlings a safer start before they make their first dash to the sea. This link between land and ocean has shaped sea turtle life for millions of years. Their migrations connect distant habitats across the globe. Few reptiles are so at home in the sea while still needing land.","Females return to beaches to nest, then head back to sea.","ocean-life,sea-turtles,nesting,reptiles",35,9,false,
sea-turtles-leatherbacks-10000-miles,ocean-life,Sea Turtles,"Leatherbacks Travel More Than 10,000 Miles a Year","Leatherback sea turtles are among the most far-traveling animals on Earth. Some swim more than 10,000 miles a year between feeding areas and nesting beaches. Those journeys carry them across entire oceans and through very different environments. Scientists track these migrations to learn how to protect the species. Their travels rival those of many birds and whales.",They cross whole oceans between feeding and nesting.,"ocean-life,sea-turtles,leatherbacks,migration",35,10,false,
sea-turtles-thousands-of-miles,ocean-life,Sea Turtles,Sea Turtles Can Migrate Thousands of Miles,"Many sea turtles make enormous journeys during their lives, traveling between feeding grounds and nesting beaches hundreds or thousands of miles apart. Amazingly, they can find the same regions over and over, even after crossing vast stretches of open ocean. Scientists are still figuring out how they navigate so well. Their journeys rank among the greatest migrations in the animal world.",They find the same beaches again and again across open ocean.,"ocean-life,sea-turtles,migration,ocean",35,10,false,
sea-turtles-threats-human-activity,ocean-life,Sea Turtles,Sea Turtles Face Threats From Fishing Nets and Plastic,"Modern sea turtles face many dangers created by humans. Fishing gear, ocean trash, lost habitat, and climate change all threaten them. Getting tangled in nets and swallowing plastic can be especially deadly — a floating plastic bag can look just like a jellyfish. Conservation programs work to cut these risks and protect them. The future of sea turtles depends heavily on what people do.",Nets and plastic bags are among their biggest dangers.,"ocean-life,sea-turtles,conservation,plastic",35,9,false,
sea-stars-not-fish,ocean-life,Sea Stars,Sea Stars Aren't Actually Fish,"Despite the nickname “starfish,” sea stars aren't fish at all. They belong to a group called echinoderms and are more closely related to sea urchins and sand dollars than to any fish. That's why scientists now prefer the name “sea star.” These animals have unusual bodies and abilities unlike most ocean creatures. Their misleading name hides one of the sea's strangest animals.","Despite the name 'starfish,' they're cousins of sea urchins.","ocean-life,sea-stars,echinoderms,animals",35,10,false,
sea-stars-forty-arms,ocean-life,Sea Stars,Some Sea Stars Have 40 Arms,"Most people picture sea stars with five arms, but some species have far more. Scientists have found ones with 10, 20, and even 40 arms. The extra limbs help these species move, feed, and regrow after injury. The huge variety shows how diverse sea stars really are. Nature has made them in shapes that almost look alien.","Forget five arms — some have ten, twenty, even forty.","ocean-life,sea-stars,arms,biodiversity",35,10,false,
sea-stars-regrow-bodies,ocean-life,Sea Stars,Sea Stars Can Regrow Entire Bodies,"Sea stars are famous for regrowing lost arms, but some can do something even wilder. In certain species, a piece of a cut-off arm — as long as it includes part of the central disc — can grow into a whole new animal. This helps them recover from injuries and survive predator attacks. Scientists still study how it works. Few animals have such incredible powers of renewal.",A single severed arm can grow into a whole new animal.,"ocean-life,sea-stars,regeneration,biology",35,10,false,
sea-stars-organs-in-arms,ocean-life,Sea Stars,Sea Stars Keep Most of Their Organs in Their Arms,"Unlike most animals, sea stars keep much of their vital anatomy inside their arms. That unusual setup is part of why they can regrow after losing a limb. It also means an arm holds far more than just muscle. Their body plan is radically different from a mammal's or a fish's. Sea stars show how strange and creative evolution can get.","Their vital organs live in their arms, not a central body.","ocean-life,sea-stars,anatomy,biology",35,10,false,
sea-stars-external-digestion,ocean-life,Sea Stars,Sea Stars Can Push Their Stomachs Outside Their Bodies,"Sea stars have one of the weirdest ways of eating in the animal kingdom. Using hundreds of tiny tube feet, they pry open shellfish like clams and oysters. Then they push their stomach out through their mouth and into the prey's shell, digesting the meal outside their own body. Once it's broken down, the stomach pulls back inside. This strange trick lets them eat food they otherwise couldn't reach.",They digest a clam by pushing their stomach into its shell.,"ocean-life,sea-stars,digestion,feeding",36,10,false,
ocean-currents-rivers-in-the-ocean,ocean-life,Ocean Currents,Ocean Currents Are Rivers Within the Ocean,"Ocean currents are often called rivers flowing through the sea. These moving masses of water carry heat, nutrients, and marine life from one place to another. Some flow near the surface, others run deep below. Together they form a huge circulation system that connects oceans around the globe. Without currents, Earth's oceans would work very differently.",Giant 'rivers' of water flow through the open sea.,"ocean-life,ocean-currents,motion,ocean",35,10,false,
ocean-currents-eight-knot-speeds,ocean-life,Ocean Currents,Some Tidal Currents Can Move Faster Than a Sprinter,"In some spots, powerful tidal currents can top eight knots — faster than many people can sprint. These rushes are strongest near coastlines and narrow passages where water gets squeezed through tight spaces. Currents like these can seriously affect boats and marine life. The ocean can move much faster than most people realize.",Some tides rush faster than a person can run.,"ocean-life,ocean-currents,speed,tides",35,10,false,
ocean-currents-thermohaline-circulation,ocean-life,Ocean Currents,Temperature and Salt Create Slow Global Currents,"Not all currents are pushed by wind or tides. Differences in temperature and saltiness change the water's density and slowly move it around the world — a process called thermohaline circulation. These deep currents carry water over enormous distances and help control Earth's climate. They move slowly, but their effect is huge. They're like a giant conveyor belt hidden beneath the waves.",A hidden 'conveyor belt' moves water around the planet.,"ocean-life,ocean-currents,thermohaline,climate",35,10,false,
ocean-currents-control-climate,ocean-life,Ocean Currents,Ocean Currents Help Control Earth's Climate,"By carrying warm water away from the equator and cold water away from the poles, ocean currents help even out global temperatures. They shape rainfall, storms, and the seasons. Without them, climates around the world would look very different. Scientists see currents as a key part of Earth's climate system. The oceans help keep the whole planet in balance.",They spread the planet's heat around like a thermostat.,"ocean-life,ocean-currents,climate,earth",35,10,false,
ocean-currents-warm-norway,ocean-life,Ocean Currents,Norway Has Milder Winters Than Expected Because of Ocean Currents,"The Gulf Stream carries warm water across the Atlantic and helps warm up northern Europe. Thanks to it, Bergen, Norway has milder winters than places much farther south — including New York City. So an ocean current can shape the weather thousands of miles from where it starts. Its effects reach far beyond the water itself. The oceans influence life on land in surprising ways.",A warm Atlantic current keeps Norway milder than New York.,"ocean-life,ocean-currents,gulf-stream,climate",35,10,false,
anglerfish-built-in-fishing-rod,ocean-life,Anglerfish,"Female Anglerfish Carry a Built-In Fishing Rod","An anglerfish does not chase prey like many other fish. National Geographic says female anglerfish have a piece of dorsal spine that sticks out above the mouth like a fishing pole. The tip has a lure of glowing flesh that baits prey close. Once another animal gets near enough, the anglerfish can snatch it with a huge mouth full of sharp, translucent teeth.","A female anglerfish hunts with a glowing lure attached to her own body.","ocean life,anglerfish,deep sea,bioluminescence,predators",48,10,false,
anglerfish-swallow-twice-size,ocean-life,Anglerfish,"Anglerfish Can Swallow Prey Twice Their Size","Anglerfish look strange for a reason. National Geographic says they have enormous crescent-shaped mouths and bodies that are very pliable. That lets them swallow prey up to twice their own size. In the deep sea, where meals can be rare, this flexibility matters. If food finally comes close, the anglerfish is built to take full advantage of it.","An anglerfish can eat animals bigger than itself because its body is so flexible.","ocean life,anglerfish,deep sea,predators,adaptations",45,10,false,
anglerfish-males-fuse-to-females,ocean-life,Anglerfish,"Male Anglerfish Fuse to Females","Male anglerfish are much smaller than females and live very different lives. National Geographic says when a young male finds a female, he bites onto her with sharp teeth. Over time, he physically fuses with her, connecting to her skin and bloodstream. He loses his eyes and internal organs except the testes, becoming a permanent parasitic mate.","Some male anglerfish survive by becoming attached to a female's body.","ocean life,anglerfish,reproduction,deep sea,adaptations",48,10,false,
anglerfish-lightless-deep-sea,ocean-life,Anglerfish,"Anglerfish Live in the Lightless Deep Sea","Many anglerfish live in one of Earth's harshest habitats. National Geographic says most live in the murky depths of the Atlantic and Antarctic oceans, up to a mile below the surface. Down there, the ocean is lonely and lightless. Their dark bodies, huge mouths, sharp teeth, and glowing lures all fit a world where finding food is difficult.","Many anglerfish live up to a mile below the surface in a dark ocean world.","ocean life,anglerfish,deep sea,atlantic ocean,antarctic ocean",45,8,false,
giant-squid-dinner-plate-eyes,ocean-life,Giant Squid,"Giant Squid Have Dinner-Plate Eyes","Giant squid have some of the most dramatic eyes in the animal kingdom. Smithsonian Ocean says each eye can be about 1 foot, or 30 centimeters, across. That is roughly the size of a dinner plate. Those huge eyes help absorb more light in the dark ocean, letting the squid glimpse glowing prey or spot predators lurking nearby.","A giant squid's eyes can be about the size of dinner plates.","ocean life,giant squid,deep sea,eyes,adaptations",42,10,false,
giant-squid-33-foot-tentacles,ocean-life,Giant Squid,"Giant Squid Can Snatch Prey 33 Feet Away","A giant squid does not need to be right next to its prey to attack. Smithsonian Ocean says it can shoot out two long feeding tentacles to grab prey up to 33 feet away. The tentacles are tipped with hundreds of powerful sharp-toothed suckers. Once prey is caught, the squid pulls it toward its arms and slices it with a sharp beak.","A giant squid can strike from 33 feet away with tentacles lined in toothed suckers.","ocean life,giant squid,tentacles,deep sea,predators",48,10,false,
giant-squid-filmed-2012,ocean-life,Giant Squid,"Scientists First Filmed a Giant Squid in Its Home in 2012","For a long time, giant squid were known mostly from dead bodies that washed up or were found by fishermen. Smithsonian Ocean says a living giant squid was first recorded in 2006 after researchers pulled one to the surface. But in 2012, scientists filmed a giant squid in its natural habitat for the first time. That finally showed the animal alive in its deep-sea world.","The giant squid stayed almost mythical until scientists filmed one in its natural habitat in 2012.","ocean life,giant squid,deep sea,discovery,science",48,9,false,
giant-squid-sperm-whale-scars,ocean-life,Giant Squid,"Sperm Whales Carry Giant Squid Battle Scars","Giant squid are huge, but they still have dangerous predators. Smithsonian Ocean says scientists have found giant squid beaks in the stomachs of sperm whales. Beach-stranded sperm whales have also been found with sucker marks on their skin. Those circular scars are large enough that only a giant squid could have caused them, hinting at deep-sea battles people almost never see.","Sperm whale skin can carry round scars from battles with giant squid.","ocean life,giant squid,sperm whales,deep sea,predators",48,10,false,
kelp-forests-grow-18-inches-day,ocean-life,Kelp Forests,"Giant Kelp Can Grow 18 Inches in a Day","Kelp forests can grow with surprising speed when conditions are right. NOAA says kelp can grow up to 18 inches per day. That fast growth helps giant kelp canopies tower above the ocean floor, more like underwater trees than ordinary seaweed. In cool, nutrient-rich water, these algae can quickly build dense habitats that look and function like forests under the sea.","Some kelp can grow fast enough to add more than a foot in a single day.","ocean life,kelp forests,giant kelp,algae,ocean habitats",48,10,false,
kelp-forests-shelter-thousands,ocean-life,Kelp Forests,"Kelp Forests Shelter Thousands of Ocean Animals","Kelp forests are not just plants waving underwater. NOAA says these underwater towers provide food and shelter for thousands of fish, invertebrates, and marine mammal species. Many young animals use the thick blades as protection from predators and rough storms. Seals, sea lions, whales, sea otters, gulls, herons, cormorants, and shore birds can all use kelp forests for food or safety.","A kelp forest can work like an underwater nursery and shelter system.","ocean life,kelp forests,marine mammals,fish,ocean habitats",52,9,false,
kelp-forests-storms-tear-apart,ocean-life,Kelp Forests,"Storms Can Tear Kelp Forests Apart","Kelp forests change with the seasons, much like forests on land. NOAA says storms and large weather events, including El Niño, can tear and dislodge kelp. That can leave behind a tattered winter forest. Then, each spring, the kelp begins growing again, rebuilding the canopy that shelters so many ocean animals.","An underwater forest can be shredded by storms and regrow with the seasons.","ocean life,kelp forests,storms,el nino,ocean habitats",45,9,false,
kelp-forests-stay-shallow,ocean-life,Kelp Forests,"Kelp Forests Usually Stay Shallow","Kelp forests need sunlight to survive. NOAA says kelp depend on light for photosynthesis, so they form in shallow open waters. They are rarely found deeper than 49 to 131 feet. That is why these dense underwater forests usually grow close to shore, in cool and nutrient-rich water where sunlight can still reach them.","Kelp forests stay shallow because even underwater forests need sunlight.","ocean life,kelp forests,photosynthesis,shallow water,algae",42,8,false,
orcas-are-dolphins,ocean-life,Orcas,"Orcas Are Actually Dolphins","Orcas are often called killer whales, but NOAA says they are the largest member of the dolphin family. That family includes all dolphin species and larger animals such as pilot whales, whose common names also use the word whale. Orcas can still reach huge sizes, up to 32 feet long and 11 tons. So the ocean's top predator is technically a very large dolphin.","The animal called a killer whale is really the biggest member of the dolphin family.","ocean life,orcas,killer whales,dolphins,marine mammals",48,10,false,
orcas-hunt-like-wolves,ocean-life,Orcas,"Orcas Hunt Like Packs of Wolves","Orcas sit at the top of the ocean food web, but they do not always hunt alone. NOAA says killer whales often use coordinated hunting strategies, working as a team like a pack of wolves. Their diets vary by population and culture. Some groups focus on fish like salmon, while others hunt marine mammals and squid.","Orcas can coordinate attacks as a team, almost like wolves of the sea.","ocean life,orcas,killer whales,hunting,marine mammals",45,10,false,
orcas-family-badge-calls,ocean-life,Orcas,"Orca Calls Can Work Like Family Badges","Orcas rely heavily on underwater sound. NOAA says they communicate with clicks, whistles, and pulsed calls. Some of these calls are unique among populations and are learned and passed on culturally. They help keep groups together and can serve as family badges, letting whales recognize and stay connected with their own pod.","Some orca calls are learned signals that can identify their family group.","ocean life,orcas,killer whales,pods,communication",48,10,false,
orcas-menopause,ocean-life,Orcas,"Orcas Are One of the Few Species With Menopause","Orcas share a rare life-history trait with humans. NOAA says killer whales, beluga whales, narwhals, short-finned pilot whales, and humans are the only known species that go through menopause. Female orcas usually live about 50 years in the wild, but can live to at least 90. That gives older females many years of life after they stop reproducing.","Only a handful of known species go through menopause, and orcas are one of them.","ocean life,orcas,killer whales,menopause,marine mammals",48,9,false,
sea-otters-keep-kelp-alive,ocean-life,Sea Otters,"Sea Otters Help Keep Kelp Forests Alive","Sea otters are more than cute animals floating in kelp. Monterey Bay Aquarium says they are a keystone species, meaning their presence has a big effect on the habitats where they live. In kelp forests, sea otters eat urchins and other invertebrates that graze on giant kelp. Without otters, urchins can overrun the ecosystem and leave behind empty areas called urchin barrens.","A sea otter can help protect an entire kelp forest by eating hungry urchins.","ocean life,sea otters,kelp forests,urchins,keystone species",50,10,false,
sea-otters-densest-fur,ocean-life,Sea Otters,"Sea Otters Have the World's Densest Fur","Unlike many marine mammals, sea otters do not have a thick layer of blubber to stay warm. Monterey Bay Aquarium says they rely on the world's densest fur instead. At its thickest, their two-layer coat has more than a million hairs per square inch. For comparison, a person probably has 100,000 hairs or less on their whole head.","A sea otter can have more hairs in one square inch of fur than you have on your head.","ocean life,sea otters,fur,marine mammals,adaptations",48,10,false,
sea-otters-chest-table,ocean-life,Sea Otters,"Sea Otters Use Their Chest Like a Table","A sea otter may hunt on the seafloor, but it returns to the surface to eat. Monterey Bay Aquarium says an otter floats on its back and uses its chest like a table. If dinner is a hard-shelled crab or clam, the otter may use a rock to crack it open. That makes mealtime look almost like a floating picnic with tools.","A sea otter can float on its back and use its own chest as a dinner table.","ocean life,sea otters,feeding,tools,marine mammals",45,9,false,
sea-otters-snack-pockets,ocean-life,Sea Otters,"Sea Otters Have Built-In Snack Pockets","Sea otters can carry food while still keeping their paws free. Monterey Bay Aquarium says their coat has pockets made from loose skin under each forearm. During a dive, an otter can stash prey in those folds and keep hunting for more. It is a simple trick that turns their body into a built-in storage pouch for underwater snacks.","Loose skin under a sea otter's arms works like pockets for food gathered during dives.","ocean life,sea otters,feeding,adaptations,marine mammals",45,10,false,
heart-size-of-fist,human-body,Heart,Your Heart Is About the Size of Your Fist,"It does one of the body's most important jobs, but the average human heart is only about the size of your clenched fist. It sits a little left of center in your chest and works nonstop your whole life. Even at that size, it pumps thousands of gallons of blood every day. Few machines ever built can match its reliability.",This fist-sized muscle pumps thousands of gallons a day.,"human-body,heart,anatomy,circulatory-system",34,8,false,
heart-center-of-network,human-body,Heart,Your Heart Sits at the Center of a Vast Transportation Network,"At the center of the circulatory system is the heart, hooked up to a giant network of arteries, veins, and capillaries. These blood vessels reach every organ and tissue in your body. Together they deliver oxygen and nutrients and carry away waste. Laid end to end, your blood vessels would stretch astonishing distances. This hidden network runs nonstop to keep you alive.",Your blood vessels could stretch for tens of thousands of miles.,"human-body,heart,blood-vessels,circulation",35,10,false,
heart-one-way-valves,human-body,Heart,Your Heart Has One-Way Valves,"Inside the heart are special valves that keep blood flowing the right way. They open and close with every heartbeat, stopping blood from slipping backward. Their perfectly timed motion keeps blood moving efficiently around the body. If a valve has problems, it can strain the heart and disrupt blood flow. These tiny flaps do their job millions of times over a lifetime.","They stop blood from flowing backward, millions of times over.","human-body,heart,valves,circulation",34,9,false,
heart-electrical-system,human-body,Heart,Your Heart Has Its Own Electrical System,"Your heart has a built-in electrical system that sets the speed and rhythm of each beat. Special cells fire off electrical pulses that spread through the muscle and trigger each contraction. That's how the heart beats automatically, without you thinking about it. Scientists compare it to the wiring inside a machine. Thanks to those signals, the heart can beat nonstop for decades.",It generates its own electric pulse — no brain needed.,"human-body,heart,electrical-system,biology",35,10,false,
brain-two-hemispheres,human-body,Brain,Your Brain Has Two Hemispheres That Specialize in Different Tasks,"The brain is split into left and right halves, connected by a thick bundle of nerve fibers called the corpus callosum. They look alike, but each half tends to specialize. Language is often centered on the left side, while the right helps with many kinds of abstract thinking. The two halves constantly talk to each other and work as a team. That partnership lets the brain handle huge amounts of information.",The two halves split the work — but talk constantly.,"human-body,brain,hemispheres,anatomy",35,10,false,
brain-crossed-control,human-body,Brain,The Right Side of Your Brain Controls the Left Side of Your Body,"Here's a strange one: the wiring between your brain and body mostly crosses sides. So the right half of your brain controls the left side of your body, and the left half controls the right side. That's why damage to one side of the brain often affects movement on the opposite side. Scientists still don't fully know why this crossover evolved. It's one of the odd quirks of human anatomy.",Signals cross over — so the left brain runs your right hand.,"human-body,brain,nervous-system,hemispheres",35,10,false,
brain-folds-more-power,human-body,Brain,Your Brain Is Wrinkled to Fit More Power,"The folds and grooves on your brain aren't random wrinkles. They pack way more surface area into your skull, letting more “gray matter” fit inside. More surface area means more room for processing information. Without the folds, your brain would have to be much bigger to do the same job. Nature solved a space problem with a clever design.",Those wrinkles cram extra thinking power into your skull.,"human-body,brain,cortex,gray-matter",35,10,false,
